{
  "id": "msconvert",
  "name": "MSConvert",
  "version": "3.0.26015",
  "description": "MSConvert: Convert mass spectrometry data formats (ProteoWizard)",
  "executionMode": "native",
  "command": {
    "executable": "msconvert"
  },
  "ports": {
    "inputs": [
      {
        "id": "input_files",
        "name": "Input Files",
        "dataType": "raw",
        "required": true,
        "accept": ["raw", "mzml", "mzxml"],
        "positional": true,
        "positionalOrder": 0
      }
    ],
    "outputs": [
      {
        "id": "mzml",
        "name": "mzML",
        "dataType": "mzml",
        "pattern": "{sample}.mzML",
        "handle": "mzml",
        "provides": ["mzml"]
      }
    ]
  },
  "parameters": {
    "format": {
      "flag": "",
      "type": "choice",
      "label": "Output Format",
      "description": "Output format",
      "group": "basic",
      "default": "mzML",
      "choices": ["mzML", "mzXML", "mgf", "mz5", "mzMLb"]
    },
    "mz_precision": {
      "flag": "",
      "type": "choice",
      "label": "m/z Precision",
      "description": "m/z precision (bits)",
      "group": "advanced",
      "default": "64",
      "choices": ["32", "64"]
    },
    "intensity_precision": {
      "flag": "",
      "type": "choice",
      "label": "Intensity Precision",
      "description": "Intensity precision (bits)",
      "group": "advanced",
      "default": "64",
      "choices": ["32", "64"]
    },
    "default_precision": {
      "flag": "",
      "type": "choice",
      "label": "Default Precision",
      "description": "Default precision (bits)",
      "group": "advanced",
      "default": "64",
      "choices": ["32", "64"]
    },
    "filters": {
      "flag": "--filter",
      "type": "value",
      "label": "Filters",
      "description": "Peak picking filters",
      "group": "advanced"
    },
    "verbose": {
      "flag": "-v",
      "type": "boolean",
      "label": "Verbose",
      "description": "Verbose output",
      "group": "advanced",
      "default": false
    }
  },
  "output": {
    "flagSupported": true,
    "flag": "-o",
    "flagValue": "."
  }
}
